{
  "chamber": "Command Ledger III",
  "cycle": "C-109",
  "test_suite": "civic-integration-tests",
  "tests": [
    {
      "name": "Civic system initializes correctly",
      "type": "unit",
      "input": {
        "command": "python3 .civic/setup-civic-system.py"
      },
      "expected_output": {
        "exit_code": 0,
        "stdout_contains": "Civic system setup complete"
      }
    }
  ],
  "integrity_anchor": "sha256:example",
  "parent_chamber": "Command Ledger III"
}